SUBJECT	SESSION	TIME	UTTERANCE	MATCHES	MATCHED	CONTEXT
49	8	00:18:03	a little bit later when we go for your hair+cut, we have to give Jim his garbage can back.	3	little, bit, back	
49	8	00:18:03	you were helping me out in the yard last week.	3	out, in, last	
49	8	00:18:03	right?	1	right	
49	8	00:18:03	can't run over the fence.	1	over	
49	8	00:18:03	I put dirt in the garbage can and -- how come I had to put all the dirt in the garbage can?	3	in, all, in	
49	8	00:18:03	right.	1	right	
49	8	00:18:03	and we're going to put the shed on concrete, right?	2	on, right	
49	8	00:18:03	it's not going to go on wood because the concrete will last much longer.	4	on, last, much, longer	
49	8	00:19:01	I got to turn this over.	2	turn, over	
49	8	00:19:01	hold on.	1	on	
49	8	00:19:01	watch out.	1	out	
49	8	00:19:01	now it -- now it won't sink as much.	1	much	
49	8	00:19:01	can you find -- can you find -- after you have a Chex_Mix can I -- can you find me another triangle?	2	after, triangle	
49	8	00:19:01	come on.	1	on	
49	8	00:19:01	hold on.	1	on	
49	8	00:19:01	oh, you can't go around the rail+road crossing!	1	around	
49	8	00:20:16	don't go around the rail+road crossing, ok?	1	around	
49	8	00:20:24	because the gates go down because that means a train is coming.	1	down	
49	8	00:20:24	we don't want to run across the -- the rail+road gate, ok?	1	across	
49	8	00:20:31	rail+road down.	1	down	
49	8	00:20:32	rail+road up.	1	up	
49	8	00:20:33	someone put that in the middle of the tracks!	2	in, middle	
49	8	00:20:33	oh, rail+road crossing down.	1	down	
49	8	00:20:46	rail+road -- up.	1	up	
49	8	00:20:46	uh -- what are you hitting over there with the fire engine?	2	over, with	
49	8	00:20:46	is it a big -- is it the big, uh -- big truck?	3	big, big, big	
49	8	00:20:46	why don't we put the other car back.	1	back	
49	8	00:20:46	I think you have enough toys, buddy.	1	enough	
49	8	00:21:12	rail+road down.	1	down	
49	8	00:21:12	oh, it's a long train.	1	long	
49	8	00:21:12	we got to wait a little bit.	2	little, bit	
49	8	00:21:12	listen to some music.	1	some	
49	8	00:21:12	how about we turn the music up.	3	about, turn, up	
49	8	00:21:12	rail+road crossing up.	1	up	
49	8	00:21:12	because that'll put what in the wall?	1	in	
49	8	00:21:12	that'll put dents in the wall.	1	in	
49	8	00:21:12	big holes.	1	big	
49	8	00:21:51	down.	1	down	
49	8	00:21:51	why don't I put some of your toys back in the toy+box, ok?	3	some, back, in	
49	8	00:21:51	it's a long train?	1	long	
49	8	00:24:12	where's the other part of your ladder?	1	part	
49	8	00:24:12	I thought your ladder -- I thought it gets really tall, doesn't it?	1	tall	
49	8	00:24:12	bring it over here.	1	over	
49	8	00:24:12	sometimes -- boys are in a building that may be on fire and the firemen have to rescue them, right?	3	in, on, right	
49	8	00:24:12	because -- um, and it's a tall building.	1	tall	
49	8	00:24:12	if it's like four stories -- like forty feet up -- boys don't want to jump out the window and their Mommies.	2	up, out	
54	7	00:33:38	it's the stuff at the very bottom to make sure it's -- it's -- got to be level and it's something to -- hard -- hard for it to --	1	bottom	
54	7	00:33:38	something for it to, um, sit on.	1	on	
54	7	00:33:38	well the foundation is the bottom.	1	bottom	
54	7	00:33:38	now since that was your building, that's ok that you knock it down.	1	down	
54	7	00:33:38	but we're building together, aren't we?	1	together	
54	7	00:33:38	you may build by yourself.	1	by	
54	7	00:33:38	so tell me about the water tower.	1	about	
54	7	00:33:38	what -- what do they keep in the water tower?	1	in	
54	7	00:35:28	do you remember we used to see a lot of pipes where we used to live.	1	lot	
54	7	00:35:28	they were doing a lot of work on -- the sewer and water pipes.	2	lot, on	
54	7	00:36:35	not a big one?	1	big	
54	7	00:36:35	we like to go to the parks in St_Louis, don't we?	1	in	
54	7	00:36:35	what was the very fun park by the -- by the highway?	2	by, by	
54	7	00:36:35	it's probably about time for us to go back to the zoo.	2	about, back	
54	7	00:36:35	I remember the last time we went to the zoo.	1	last	
54	7	00:36:35	you played in the --	1	in	
54	7	00:38:25	can I put this up here?	1	up	
54	7	00:38:25	right?	1	right	
54	7	00:38:25	mama, please don't mess up my stack.	1	up	
54	7	00:39:22	maybe you need a pipe on the other side too.	2	on, side	
54	7	00:39:29	here's some more pipes.	1	some	
54	7	00:39:29	he's going to work up here.	1	up	
54	7	00:39:29	on the roof.	1	on	
54	7	00:55:20	if mama said no, would you -- would you've knocked it down?	1	down	
54	7	00:55:20	no, please don't knock down my blocks this time.	1	down	
54	7	00:55:20	we played hurricane together then.	1	together	
54	7	00:56:00	that's much better than kicking.	1	much	
54	7	00:56:09	I'm going to make the front of it look a little different because it's the --	2	front, little	
54	7	00:57:31	oh, it carries things on the top?	2	on, top	
54	7	00:57:56	a long train that lives under the box.	2	long, under	
54	7	00:57:56	now on here.	1	on	
54	7	00:57:56	let's see if we stick it together.	1	together	
54	7	00:57:56	and that smoke+stack is too high.	1	high	
54	7	00:57:56	your knee's in the way.	1	in	
54	7	00:57:56	big big train?	2	big, big	
54	7	00:57:56	ok, I'll put this one right here.	1	right	
54	7	00:57:56	put this on top.	2	on, top	
54	7	00:57:56	wow, that's going to be a tall train.	1	tall	
54	7	00:57:56	that -- that train car can probably carry lots and lots of tall things.	1	tall	
54	7	00:57:56	what are some tall things that the train could carry?	2	some, tall	
54	7	00:57:56	what can -- what are some tall things that the engine -- the -- that the train could carry?	2	some, tall	
59	6	00:04:17	they're out there amongst a whole bunch of people.	2	out, whole	
59	6	00:06:47	that little girl -- carrying that ###	1	little	
59	6	00:06:47	Kayla, you want to go to the parade next year?	1	next	
59	6	00:06:47	yeah, you going to -- be a big girl then.	1	big	
59	6	00:09:34	he was going to try to scare you with it.	1	with	
59	6	00:09:34	you going to scare him with it?	1	with	
59	6	00:09:34	they going to try to put it by your -- going --	1	by	
59	6	00:09:34	they'll put it by your face and you wake and it'll be there in the morning trying to scare you, huh?	3	by, face, in	
59	6	00:09:34	I think you give them a little bit -- a little bit too much credit.	5	little, bit, little, bit, much	
59	6	00:09:34	they try -- they try to scare you with that.	1	with	
59	6	00:09:34	wait until you in some kind of ###	2	in, some	
59	6	00:14:19	I saw you got another surprise that's on the floor.	1	on	
59	6	00:14:19	there's a little kitten or something.	1	little	M and C at same time
59	6	00:15:24	you put it in there on the floor.	2	in, on	
59	6	00:16:00	there was a dragon on tv.	1	on	
59	6	00:18:35	we'll look up for your brothers.	1	up	
59	6	00:19:08	they're right there on the floor.	2	right, on	
59	6	00:20:55	you -- you knocked it down.	1	down	
59	6	00:20:56	did you knock it down?	1	down	
59	6	00:20:56	you knocked -- you keep knocking it down.	1	down	
59	6	00:26:32	look at -- look up there.	1	up	
59	6	00:27:55	you don't want that on camera.	1	on	
59	6	00:36:53	that was before your time.	1	before	
59	6	00:36:53	his mouth, but what is this sticking out of his mouth?	1	out	
59	6	00:36:53	don't drag that across the floor.	1	across	
59	6	00:36:53	what -- what's that sticking out his mouth?	1	out	
59	6	00:36:53	so remember you can put your money in here.	1	in	
59	6	00:36:53	or your little old lip stick.	1	little	
59	6	00:36:53	I mean you little um --	1	little	
59	6	00:03:19	what did you do with Buzz?	1	with	
59	6	00:03:19	ok, I'm going to put it up.	1	up	
59	6	00:04:19	go back.	1	back	
59	6	00:05:19	in my bottle.	1	in	
59	6	00:05:19	get that up off the floor.	1	up	
59	6	00:05:19	don't let them see you suck that bottle on tv.	1	on	
59	6	00:07:02	stand up.	1	up	
59	6	00:08:12	did Jasmine tell you to throw this in the garbage?	1	in	
59	6	00:08:12	she didn't tell you to throw this in the garbage?	1	in	
59	6	00:08:12	she said she thinks you should throw this in the garbage because you're a big girl now.	2	in, big	
59	6	00:10:59	you to big for that bottle.	1	big	
59	6	00:10:59	take it out your mouth did you say?	1	out	
59	6	00:11:39	your teeth going to start sticking out of your mouth.	1	out	
59	6	00:11:45	they don't know anything about your speech because you do not do anything but suck on you bottle.	2	about, on	
59	6	00:11:45	take that out your mouth talk to me.	1	out	
59	6	00:14:48	I will throw it in the garbage.	1	in	
59	6	00:20:31	then get -- get it from over here.	1	over	
59	6	00:20:31	get from over here.	1	over	
65	7	00:58:16	ooh, Charlie, let's build that up again, ok?	1	up	
65	7	00:58:26	oh, your tunnel, right.	1	right	
65	7	00:58:26	and we don't want to knock down Jay's tunnels.	1	down	
65	7	00:58:26	you can play with other blocks.	1	with	
65	7	00:58:26	here, let me -- let's get out some blocks that Charlie can play with, ok?	3	out, some, with	
65	7	00:58:26	there's enough for both of you.	1	enough	
65	7	00:58:26	oh, you're right.	1	right	
65	7	00:58:26	that's not part of this set.	1	part	
65	7	00:58:26	you want to play with --	1	with	
65	7	00:58:54	I know but look how many are in the box, Jay.	1	in	
65	7	00:58:54	you need all your blocks?	1	all	
65	7	00:59:16	want to play with Mr_Potato_Head, Charlie?	1	with	
65	7	00:59:58	goes in here, Charlie?	1	in	
72	4	00:15:50	how about this one?	1	about	
72	4	00:15:50	they fell down like blocks.	1	down	
72	4	00:15:50	you want to take some of these off and put them -- over here.	2	some, over	
72	4	00:15:50	on.	1	on	
72	4	00:15:50	ok we'll leave it on.	1	on	
72	4	00:15:50	leave it on.	1	on	
72	4	00:15:50	oval.	1	oval	
72	4	00:15:50	is there another oval there?	1	oval	
72	4	00:57:27	nice picture on there.	1	on	
72	4	00:57:27	why don't I throw that in the garbage.	1	in	
72	4	00:57:27	you can take the top off.	1	top	
72	4	00:57:27	some of these are different.	1	some	
72	4	00:57:50	you can open it and close it.	1	close	
72	4	00:57:50	let's see what else is in here.	1	in	
72	4	00:58:06	you can put legos on that.	1	on	
72	4	00:58:06	let's see what else is in here.	1	in	
72	4	00:58:06	let's cut this open with the scissor.	1	with	
72	4	00:58:06	I'm just going to put them right in here.	2	right, in	
72	4	00:58:06	then you can take them out.	1	out	
72	4	00:58:53	how about this one?	1	about	
72	4	00:58:53	let's see what else is in here.	1	in	
72	4	00:58:53	this one has different colors in it.	1	in	
72	4	00:58:53	is that all the packages?	1	all	
72	4	00:58:53	what else do we have in here?	1	in	
72	4	01:00:18	it has a picture on it	1	on	
72	4	01:00:28	this is a really big one.	1	big	
72	4	01:00:28	really big one.	1	big	1:00:32 End of tape one.
72	4	00:15:12	take it apart.	1	apart	
72	4	00:15:11	here's a big one.	1	big	
72	4	00:15:11	that a big one?	1	big	
72	4	00:15:11	and then we could build a really big slide like this.	1	big	
72	5	00:26:05	they'll wait for the leggos to come, right.	1	right	
72	5	00:26:05	let's put some on there for them, ok?	2	some, on	
72	5	00:26:05	my Bonny lies over the ocean?	1	over	
72	5	00:26:05	you can put it on there.	1	on	
72	5	00:26:05	you don't have to give up.	1	up	
72	5	00:27:07	they might want to have a snail in their house.	1	in	
72	5	00:27:07	they might want to have a snail in their house.	1	in	
72	5	00:27:07	you want to build something with a window for them?	1	with	
72	5	00:27:07	should we put a window in there?	1	in	
72	5	00:29:00	you can put half of it on there.	2	half, on	
72	5	00:29:00	must be -- over here.	1	over	
72	5	00:29:00	it's over on this side.	3	over, on, side	
72	5	00:29:00	oh, the front.	1	front	
72	5	00:29:00	we have to look for that piece.	1	piece	
72	5	00:29:00	let's see if we can find that little piece.	2	little, piece	
72	5	00:29:00	maybe it's in here.	1	in	
72	5	00:29:00	not in this box.	1	in	
72	5	00:29:00	it might be in the other box.	1	in	
72	5	00:31:51	I think the other one is red, right?	1	right	
72	5	00:31:51	I don't see it in here.	1	in	
72	5	00:31:51	I think we're going to have to look around for it.	1	around	
72	5	00:31:51	it might be -- under the couch or something.	1	under	
72	5	00:31:51	I don't see it in the box.	1	in	
72	5	00:31:51	later on saturday?	1	on	
72	5	00:33:12	clips in there ### click, and -- and then you close it it goes -- click.	2	in, close	
72	5	00:33:12	is there a clock in there?	1	in	
72	5	00:33:12	you can see out the window?	1	out	
72	5	00:34:05	why don't we put, um, some people on this side of the window and then somebody on the other side of the window and then they can talk to each other.	5	some, on, side, on, side	
72	5	00:34:05	here, how about this one?	1	about	
72	5	00:34:05	here, these are some -- people who can talk to each other -- through the window if you want to.	2	some, through	
72	5	00:34:05	I don't think he fits on there.	1	on	
72	5	00:34:05	even though he has a hole on the bottom he doesn't fit on there because he didn't come with the leggos.	4	on, bottom, on, with	
72	5	00:34:05	he came with a different --	1	with	
72	5	00:34:05	he came with a farm, remember?	1	with	
72	5	00:34:05	he's part of the farm set.	1	part	
72	5	00:34:05	so he's not -- doesn't fit on a leggo unfortunately.	1	on	
72	5	00:34:05	the little boy?	1	little	
72	5	00:34:05	I don't know where that little boy went.	1	little	
72	5	00:34:05	they live on the farm, right.	2	on, right	
72	5	00:34:05	I don't see the little boy.	1	little	
72	5	00:34:05	I think there was only one horse -- that came with it.	1	with	
72	5	00:27:10	how about if I -- how about if I cut up an apple for you?	3	about, about, up	
72	5	00:27:10	how about if I cut up an apple.	2	about, up	
72	5	00:27:10	how about apple+sauce?	1	about	
72	7	00:36:54	you could play with them.	1	with	
72	7	00:36:54	and you know how to play um -- you know all the Dora pieces.	2	all, pieces	
72	7	00:36:54	that goes on top huh?	2	on, top	
72	7	00:36:54	just try -- just try pushing it down a little more.	2	down, little	
72	7	00:36:54	further.	1	further	
72	7	00:38:14	see it has these pieces on the bottom.	3	pieces, on, bottom	
72	7	00:38:14	so it has to fit in just like the Legos do.	1	in	
72	7	00:38:31	we can put Dora on it.	1	on	
72	7	00:38:31	oh you want it next to that?	1	next	
72	7	00:38:31	you want to put it right next to that wall?	2	right, next	
72	7	00:38:31	got to -- find Dora in here.	1	in	
72	7	00:38:31	go ride on that if you want to.	1	on	
72	7	00:39:59	this reminds me of the um slide going into the swimming pool.	1	into	
72	7	00:39:59	remember that slide that we went on.	1	on	
72	7	00:39:59	well we didn't go on it but we saw it.	1	on	
72	7	00:39:59	we saw people going down that slide and they went into that big swimming pool.	3	down, into, big	
72	7	00:39:59	went Galena with Grandma and Grandpa?	1	with	
72	7	00:40:19	they had a big slide that went around and around and then people went down and dropped into the pool.	5	big, around, around, down, into	
72	7	00:40:19	they went right into the pool because it was a lot of fun.	3	right, into, lot	
72	7	00:40:32	the would ride down the slide and go boom right into the swimming pool.	3	down, right, into	
72	7	00:40:32	it's probably in there.	1	in	
72	7	00:40:32	let's look around for it.	1	around	
72	7	00:40:32	oh you're looking for the little car right?	2	little, right	
72	7	00:41:35	right?	1	right	
72	7	00:41:35	and the little car.	1	little	
72	7	00:41:35	we'll have to look around for those.	1	around	
72	7	00:41:35	I don't know they might -- might not be in this bin.	1	in	
72	7	00:41:35	### a good piece.	1	piece	
72	7	00:42:09	and look who I found on the yellow car.	1	on	
72	7	00:42:09	but I haven't seen it in here.	1	in	
72	7	00:42:09	you can make him stand on there.	1	on	
72	7	00:44:32	see he's sitting one side.	1	side	
72	7	00:44:32	so it just stays down on one side.	3	down, on, side	
72	7	00:44:32	he weighs it down.	1	down	
72	7	00:44:32	because he's the only one on the swing.	1	on	
72	7	00:44:32	she has to weigh it on the other side.	2	on, side	
72	7	00:44:32	right?	1	right	
72	7	00:44:32	yeah it works a little bit better.	2	little, bit	
72	7	00:44:32	so see how her side stays down a little more?	3	side, down, little	
72	7	00:45:24	so we can find something to weigh his side down a little more.	3	side, down, little	
72	7	00:45:24	what could we add to his side?	1	side	
72	7	00:46:31	is it going in the pool?	1	in	
72	7	00:46:31	he's going to go in the pool.	1	in	
72	7	00:48:31	try her on top.	2	on, top	
72	7	00:48:31	wonder why it doesn't stand up.	1	up	
72	7	00:48:55	I guess because it was -- I think it was -- just on an angle from one of these little Lego -- um Lego holes.	3	on, angle, little	
72	7	00:48:55	I don't think it will Peek because I don't think -- I think for these pieces they have to have room.	1	pieces	
72	7	00:49:32	see how his feet don't have enough room with the Lego there?	2	enough, with	
72	7	00:49:49	they have to have two legs -- two lines of Lego spots.	1	lines	
72	7	00:49:49	the little holes.	1	little	
72	7	00:49:49	and then she has to go up there.	1	up	
72	7	00:49:49	she can't go in one next to him because she has to have enough room.	3	in, next, enough	
72	7	00:49:49	she's turning around huh?	2	turning, around	
72	7	00:49:49	let's get something we can build a door with.	1	with	
72	7	00:49:49	on that side?	2	on, side	
72	7	00:49:49	and then we put one on top.	2	on, top	
72	7	00:49:49	oh, we need a bigger one.	1	bigger	
72	7	00:49:49	where's a really really big one.	1	big	
72	7	00:49:49	do we have any really big ones?	1	big	
72	7	00:49:49	this is perfect size.	1	size	
72	7	00:49:49	you know what, we could build it -- let's make it taller.	1	taller	
72	7	00:49:49	because she doesn't fit in there.	1	in	
72	7	00:49:49	so we'll make it a little taller.	2	little, taller	
72	7	00:49:49	take this piece off.	1	piece	
72	7	00:52:08	and how can we make it taller?	1	taller	
72	7	00:52:08	how can we make it taller?	1	taller	
72	7	00:52:46	and then we have to add one to this side too, right?	2	side, right	
72	7	00:52:46	right?	1	right	
72	7	00:52:46	we need a little one.	1	little	
72	7	00:52:46	just a square one.	1	square	
72	7	00:53:00	and then what do you need to put on top?	2	on, top	
72	7	00:53:00	you need to put the top of the door frame right?	2	top, right	
72	7	00:53:00	like it was before.	1	before	
72	7	00:53:00	and now you've got a taller door.	1	taller	
72	7	00:53:00	so she should fit through there.	1	through	
72	7	00:53:00	right?	1	right	
72	7	00:53:00	we need to make it wider.	1	wider	
72	7	00:53:00	we need to make it wider for her arms I think.	1	wider	
72	7	00:53:00	how can we make it wider?	1	wider	
72	7	00:53:00	but how can we make it wider?	1	wider	
72	7	00:53:00	how do we make it wider for them?	1	wider	
72	7	00:53:00	how can we make it wider for them to fit through?	2	wider, through	
72	7	00:53:58	see their arms are so wide.	1	wide	
72	7	00:54:01	how can we make it wider?	1	wider	
72	7	00:54:01	oh, but you're making it taller.	1	taller	
72	7	00:54:01	see you're making it taller that way.	1	taller	
72	7	00:54:01	right?	1	right	
72	7	00:54:01	how can we make the door wider?	1	wider	
72	7	00:54:01	so they can fit through?	1	through	
72	7	00:54:01	how should we make it wider?	1	wider	
72	7	00:54:01	how about we make it wider.	2	about, wider	
72	7	00:54:01	how about this.	1	about	
72	7	00:54:01	how about this Robert.	1	about	
72	7	00:54:01	what if I move this over like this?	1	over	
72	7	00:54:01	what if I move this piece?	1	piece	
72	7	00:54:01	then maybe they'll fit through.	1	through	
72	7	00:55:01	how did I make it wider?	1	wider	
72	7	00:55:01	now you're making it taller right?	2	taller, right	
72	7	00:55:01	you're making it taller?	1	taller	
72	7	00:55:01	really tall.	1	tall	
72	7	00:55:01	if you put it on --	1	on	
72	7	00:55:01	I'll give you a little hint.	1	little	
72	7	00:55:01	it you put it on this inner one right here it will fit.	2	on, right	
72	7	00:55:01	and it will give you the whole width of the door.	2	whole, width	
72	7	00:55:01	is it going on there?	1	on	
72	7	00:55:01	you have to just line it up right.	3	line, up, right	
72	7	00:56:57	can you line it up?	2	line, up	
72	7	00:56:57	now they go through easily.	1	through	
72	7	00:56:57	because there's enough room for them now.	1	enough	
72	7	00:56:57	why did you make it really tall?	1	tall	
72	7	00:57:17	they needed it to be a little bit taller.	3	little, bit, taller	
72	7	00:57:19	all the way up.	2	all, up	
72	7	00:57:19	she fell over.	1	over	
72	7	00:57:19	she might have gotten a boo+boo on her head.	2	on, head	
72	7	00:57:19	she's wearing her back+pack on her tummy this time hmm?	1	on	
72	7	00:58:47	should we turn her back the right way?	3	turn, back, right	
72	7	00:58:47	let's see if we turn her this way.	1	turn	
72	7	00:58:47	you want to see in the play+room?	1	in	
72	7	00:58:47	make it higher?	1	higher	
73	6	00:07:25	come on wash.	1	on	
73	6	00:07:25	give me -- give me that soap over there.	1	over	
73	6	00:07:25	you got to rub it on your butt.	1	on	
73	6	00:07:25	all of it.	1	all	
73	6	00:07:25	behind your knees.	1	behind	
73	6	00:07:25	behind your knees.	1	behind	
73	6	00:07:25	leave it in there.	1	in	
73	6	00:07:25	go ahead.	1	ahead	
73	6	00:07:25	I'll be right back.	2	right, back	
73	6	00:07:25	come over here.	1	over	
73	6	00:07:25	throw all those in the garbage.	2	all, in	
73	6	00:07:25	yes, all this -- all this paper here.	2	all, all	
73	6	00:07:25	just put those three books over there.	1	over	
73	6	00:07:25	right there.	1	right	
73	6	00:13:30	come on mama.	1	on	
73	6	00:13:30	Justin, give me some powder from in there.	2	some, in	
73	6	00:13:30	it's right there.	1	right	
74	5	00:58:09	that's right.	1	right	
74	5	00:58:09	gravity knocked it down.	1	down	
74	5	00:58:09	that's right.	1	right	
74	5	00:58:09	you're in such a good mood huh Bobo?	1	in	
74	5	00:59:09	ok let's move it closer.	1	closer	
74	5	00:59:09	we'll move it closer ok?	1	closer	
74	5	00:59:09	knock it down.	1	down	
74	5	00:59:09	we're going to take this away because it's spilling.	1	away	
74	5	00:59:09	ok when you're done with it put it up on the table so it doesn't spill all over the floor please.	5	with, up, on, all, over	
74	6	00:47:39	you can go underneath this part.	2	underneath, part	
74	6	00:47:39	if it doesn't fall on your head.	2	on, head	
74	6	00:47:39	let me look in your diaper.	1	in	
74	6	00:47:39	yeah, Gabby there's something in there.	1	in	
74	6	00:47:39	come on.	1	on	
74	6	00:47:39	well, either lay down here or go to your changing table, ok.	1	down	
75	8	00:37:48	it's green on one side red on one side.	4	on, side, on, side	
75	8	00:37:48	these are all yours.	1	all	
75	8	00:38:02	I think I see one of mine in there.	1	in	
75	8	00:38:02	all in a row and make it go choo+choo?	3	all, in, row	
75	8	00:38:02	little handles?	1	little	
75	8	00:38:02	to push it with?	1	with	
75	8	00:38:02	what's going to make your little handles then?	1	little	
75	8	00:38:02	how about all -- shall I build mine and we'll make them --	2	about, all	
75	8	00:38:02	I'm just getting them out of the way so I can build my train.	1	out	
75	8	00:38:02	I'm going to do a pattern on mine Joe?	2	pattern, on	
75	8	00:38:02	I was going to do a pattern of alternating blue and yellow.	1	pattern	
75	8	00:38:02	hey how come your train is bigger?	1	bigger	
75	8	00:38:02	I think I'll make mine a little bigger so they're even.	2	little, bigger	
75	8	00:39:31	count them up.	1	up	
75	8	00:39:40	eight.	1	eight	
75	8	00:39:40	I got eight.	1	eight	
75	8	00:39:51	eight.	1	eight	
75	8	00:39:56	eight.	1	eight	
75	8	00:40:03	you're going to build it all the way to mine?	1	all	
75	8	00:40:03	I'm going to build mine all the way to yours.	1	all	
75	8	00:40:03	whoa who's going to get there first?	1	first	
75	8	00:40:03	let's see if we can stack them this way in between the trains, ok?	2	in, between	
75	8	00:40:22	keep stacking them on there.	1	on	
75	8	00:40:22	your turn.	1	turn	
75	8	00:40:22	you only want them all flat huh?	2	all, flat	
75	8	00:40:22	this is my engine at the front of my train.	1	front	
75	8	00:40:22	and like the back here honey?	1	back	
75	8	00:40:22	that is one long train Joe.	1	long	
75	8	00:41:19	can you count them up?	1	up	
75	8	00:41:19	you mean first you need to line them all up?	4	first, line, all, up	
75	8	00:41:19	count them up now.	1	up	
75	8	00:41:32	well we'll do it together.	1	together	
75	8	00:41:33	well, what else could we do with them?	1	with	
75	8	00:41:33	we made a long train.	1	long	
75	8	00:41:33	I made a tall train.	1	tall	
75	8	00:41:47	you did make a longer train.	1	longer	
75	8	00:41:47	right.	1	right	
75	8	00:41:47	well for some reason it looks like you have more blocks then I have.	1	some	
75	8	00:41:47	I will build a bridge and your train can go under the bridge.	1	under	
75	8	00:42:34	see the problem is Joe we can only make it so wide.	1	wide	
75	8	00:42:34	we don't have anything to put across the top.	2	across, top	
75	8	00:42:34	I guess I could put this thing across the top huh?	2	across, top	
75	8	00:42:34	put your train under the bridge.	1	under	
75	8	00:42:34	so what are you going to put on top then if you don't like that.	2	on, top	
75	8	00:43:00	what could be the top of the bridge honey?	1	top	
75	8	00:43:31	but we need a top.	1	top	
75	8	00:43:31	you know how to make a top yourself.	1	top	
75	8	00:43:31	yours is bigger huh?	1	bigger	
75	8	00:43:31	you want it back over by you?	3	back, over, by	
75	8	00:43:31	what are you going to do with those honey?	1	with	
75	8	00:44:30	right now honey you don't have a bridge.	1	right	
75	8	00:44:30	right now you have a tower.	1	right	
75	8	00:44:40	ok, a bridge honey is like two towers that are connected on top and then things go underneath it.	3	on, top, underneath	
75	8	00:44:40	let's have a contest to see who can make theirs the tallest.	1	tallest	
75	8	00:44:40	can you make one that high?	1	high	
75	8	00:44:40	can you stack them that high?	1	high	
75	8	00:44:40	I want to make it even bigger.	1	bigger	
75	8	00:44:40	check that out.	1	out	
