SUBJECT	SESSION	TIME	UTTERANCE	MATCHES	MATCHED	CONTEXT
85	4	00:25:55	so much garbage in the cup, Jordan.	2	much, in	
85	9	00:05:00	you never built towers like that before, Jordan.	1	before	
85	9	00:05:00	this is the first time.	1	first	
85	9	00:05:00	they're very tall.	1	tall	
85	9	00:05:00	you want to see if you can do it with the ant blocks too?	1	with	
85	9	00:05:00	get the ant blocks and maybe you can build another tower right next to that tower.	2	right, next	
85	9	00:05:00	### get it out?	1	out	
85	9	00:05:00	dump them out on the floor.	2	out, on	
85	9	00:05:00	you can crash them together.	1	together	
85	9	00:05:00	you want to build one with the ant blocks too?	1	with	
85	9	00:05:00	you're going to put the ant paths together?	2	paths, together	
85	9	00:05:00	maybe once you put the ants together then you can use the dinosaur to follow the ant trails on top of the blocks.	3	together, on, top	
85	9	00:05:00	a lot of what?	1	lot	
85	9	00:05:00	do you want your little dinosaurs, too?	1	little	
85	9	00:05:00	I think your little dinosaurs are in --	2	little, in	
85	9	00:05:00	little dinosaur.	1	little	
85	9	00:05:00	somebody colored on that.	1	on	
85	9	00:05:00	you could still play with your blocks even when there's color on it.	2	with, on	
85	9	00:05:00	it's it's not a really a big deal.	1	big	
85	9	00:05:00	there's more letter blocks behind your tower.	1	behind	
85	9	00:10:08	do you want to eat a lot of food or a little bit of food?	3	lot, little, bit	
85	9	00:03:14	so I'm trying to put them in some sort of -- spreadsheet so I can look at them ###	2	in, some	
85	9	00:03:14	I have some Michael_Jordan cards somewhere.	1	some	
85	9	00:03:14	got a lot of Bulls cards.	1	lot	
85	9	00:03:14	hold on.	1	on	
85	9	00:03:14	these are all the -- Pistons.	1	all	
85	9	00:03:14	I'm not too keen on the Pistons.	1	on	
85	9	00:03:14	that's Ok because they're in the plastic.	1	in	
85	9	00:04:11	I don't know how to figure out how these are worth any money.	1	out	
85	9	00:04:19	he was in a good movie called Space_Jam.	1	in	
85	9	00:04:19	so do you want me to make you some food?	1	some	
85	9	00:04:19	do you want me to make you some food?	1	some	
85	9	00:04:19	come on.	1	on	
85	9	00:04:19	I'll make you some food.	1	some	
85	9	00:04:19	we got tons of boxes to go through.	1	through	
85	9	00:04:19	how about chicken noodle soup?	1	about	
85	9	00:04:19	Jordan I only feel like opening up a can of something for you.	1	up	
85	9	00:06:10	this one's some pizza thing.	1	some	
85	9	00:06:18	I called him to see if you guys could play later together.	1	together	
85	9	00:06:18	I thought maybe you guys could go out together today.	2	out, together	
85	9	00:06:18	that's what Jackson does on the weekends.	1	on	
85	9	00:06:18	ready to start cleaning up?	1	up	
85	9	00:07:40	show me with your hands.	1	with	looks like counting number five
85	9	00:07:40	I'm going to start cleaning up without you.	1	up	
85	9	00:07:40	how about I play and then you can --	1	about	
85	9	00:09:41	three more minutes ### we're going to clean up all these toys.	2	up, all	
85	9	00:10:03	if you want to start putting -- playing with the trains, you have to clean up the blocks and the dinosaurs.	2	with, up	
85	9	00:10:03	because there's a big mess on the floor.	2	big, on	can't see on tape, remember from session
85	9	00:10:03	do you want to play with the trains?	1	with	
85	9	00:10:03	if the answer is yes then you have to clean up your blocks.	1	up	
85	9	00:10:03	clean up your blocks and your dinosaurs.	1	up	
85	9	00:10:03	and then you can play with these trains.	1	with	
85	9	00:10:03	you just put the dinosaur blocks in the -- in the --	2	in, in	
85	9	00:10:03	you dumped out your cars, too, huh?	1	out	
85	9	00:10:03	you can leave all the train stuff out.	2	all, out	
85	9	00:11:29	do the ant blocks go with the letter blocks?	1	with	
85	9	00:11:29	the ant blocks go in a different box.	1	in	
85	9	00:11:29	over there!	1	over	
85	9	00:11:29	over there!	1	over	
85	9	00:11:29	do the letter blocks first then.	1	first	
85	9	00:11:29	you putting ### all the letter blocks first?	2	all, first	
85	9	00:11:29	this is a little dinosaur.	1	little	
85	9	00:12:23	come on.	1	on	
85	9	00:12:25	I got half the cars and I got this almost filled up.	2	half, up	
85	9	00:12:25	can you do the ant blocks before I finish the letter blocks?	1	before	
85	9	00:12:25	maybe we'll win together.	1	together	
85	9	00:12:25	yeah we are working together.	1	together	
85	9	00:12:25	the ultimate winner will be the first person to put their stuff all up on the shelf.	4	first, all, up, on	
85	9	00:13:19	we'll leave your trains out.	1	out	
85	9	00:13:19	### to play with your trains.	1	with	
85	9	00:13:28	### little ###	1	little	
85	9	00:13:39	we well we won together.	1	together	
85	9	00:13:39	how about you?	1	about	
85	9	00:13:48	you need some more letter blocks?	1	some	
85	9	00:13:49	come on.	1	on	
85	9	00:14:00	but I want you to clean up a little bit better.	3	up, little, bit	
85	9	00:14:09	he goes up here with the stuffed animals.	2	up, with	
85	9	00:14:09	you're right.	1	right	
85	9	00:14:43	with my eyes.	1	with	
85	9	00:14:43	### rub the hurt away?	1	away	
85	9	00:14:43	we're making some progress.	1	some	
87	8	00:52:32	you see a m@l on one of those blocks?	1	on	
87	8	00:52:32	yeah, clean up.	1	up	
89	6	00:21:57	pick them up.	1	up	
89	6	00:22:08	right here.	1	right	
89	6	00:22:08	you forgot a block in here.	1	in	
89	6	00:22:08	hold on.	1	on	
89	6	00:22:08	he'll be out in a few minutes Zoie.	2	out, in	
89	6	00:22:08	you told me to close the door.	1	close	
91	4	00:04:59	Bella, do you want to do this one again or build a bigger blocks ###?	1	bigger	
91	4	00:04:59	you can do computer a bit later.	1	bit	
91	4	00:04:59	yeah, you need to lean on a book.	1	on	
91	4	00:04:59	here, lean on these Catherine.	1	on	
91	4	00:04:59	well, that's why you need to lean on something.	1	on	
91	4	00:04:59	you can lean on this one.	1	on	
91	4	00:04:59	and are you going to draw some faces?	2	some, faces	
91	4	00:02:06	it's cold out.	1	out	
91	4	00:02:06	I think the key should work in other places too.	2	in, places	
100	7	00:31:00	Woody can come too, right?	1	right	
100	7	00:31:00	two sides?	1	sides	
100	7	00:31:00	of a two sided bridge?	1	sided	
100	7	00:31:37	well here's some purple over there.	2	some, over	
100	7	00:31:37	oh the same size?	1	size	
100	7	00:31:37	here this is the same height I think.	1	height	
100	7	00:31:37	well yeah that's the same height.	1	height	
100	7	00:32:05	it's just not as long.	1	long	M holding hands apart to measure length
100	7	00:32:10	oh I don't know if we have a long purple one.	1	long	
100	7	00:32:10	is there more in there?	1	in	
100	7	00:32:15	how about the pink one?	1	about	
100	7	00:32:43	we need something to hold it together?	1	together	
100	7	00:33:00	maybe the baby wants to come in and play too.	1	in	
100	7	00:34:16	a big bridge.	1	big	
100	7	00:34:16	or you want to do it by yourself?	1	by	
100	7	00:34:16	you do it by yourself?	1	by	
100	7	00:35:00	and they can walk across that bridge, huh?	1	across	
100	7	00:36:00	maybe there more in here, huh?	1	in	
100	7	00:36:00	I looked in there I didn't see any.	1	in	
100	7	00:36:38	and look Max even the little -- the little Buzzes can go across the bridge.	3	little, little, across	
100	7	00:37:00	is there some in here?	2	some, in	
100	7	00:37:00	here's some other Buzzes we can -- you can put on your bridge.	2	some, on	
100	7	00:37:20	because they're smaller than the other guys.	1	smaller	
100	7	00:37:20	let's look in the other drawers.	1	in	
100	7	00:37:20	I think there's some --	1	some	
100	7	00:37:20	and look Max this clips on the --	1	on	
100	7	00:37:39	Pooh fits on there.	1	on	
100	7	00:37:39	well let's just play with this.	1	with	
100	7	00:38:00	you want to put him on?	1	on	
100	7	00:38:00	we can jump over Pooh?	1	over	
100	7	00:38:55	here's Woody on the horse.	1	on	
100	7	00:39:19	Max let's put this bridge together.	1	together	
100	7	00:39:19	and then we can get these guys -- can go across the bridge.	1	across	
100	7	00:39:19	I think that's all -- that's in there.	2	all, in	
100	7	00:39:19	no I don't know what happened to all the other --	1	all	
100	7	00:39:19	well I don't see any of the -- other blocks in here.	1	in	
100	7	00:40:00	I think we have enough to work with.	2	enough, with	
100	7	00:40:00	well we got a lot of people too.	1	lot	
100	7	00:40:00	we need a good long bridge, huh?	1	long	
100	7	00:41:00	should I put something to hold them together?	1	together	
100	7	00:41:00	I'm going to take this long one off.	1	long	
100	7	00:41:00	you connected them together.	1	together	
100	7	00:41:00	in there?	1	in	
100	7	00:41:00	in the bridge?	1	in	
100	7	00:41:00	in the center?	2	in, center	
100	7	00:41:00	we can go back.	1	back	
100	7	00:49:00	we didn't -- we didn't get a chance to make our guys walk on it.	1	on	
100	7	00:49:00	the little Buzzes will fit on there.	2	little, on	
100	7	00:49:46	we have a little dog.	1	little	
100	7	00:49:46	that little grey dog.	1	little	
100	7	00:49:53	I think it's in one of those -- uh -- drawers.	1	in	
100	7	00:49:53	Max don't dump everything out.	1	out	
100	7	00:49:53	just open the drawer and look in it.	1	in	
100	7	00:49:53	he's in there somewhere.	1	in	
100	7	00:35:52	come on.	1	on	
100	7	00:35:52	all the air's coming out.	2	all, out	
100	7	00:35:52	oh you let all the air out.	2	all, out	
100	7	00:35:52	ok let's put this puzzle together.	1	together	
100	7	00:37:23	let's put the -- let's put this together.	1	together	
100	7	00:37:23	don't you want to do the puzzle with me?	1	with	
100	7	00:37:42	did you slobber on the end of this?	1	on	
100	7	00:37:42	Max put those back on your bed.	2	back, on	
100	7	00:37:42	put them back on your bed, Max.	2	back, on	
100	7	00:39:04	I think my nails are too long.	1	long	
100	7	00:39:14	are you ok, big guy?	1	big	
100	7	00:39:14	I think we got too much stuff out.	2	much, out	
100	7	00:41:24	no, there's one in here already.	1	in	
100	7	00:41:24	well play with that one.	1	with	
100	7	00:41:24	let's just play with the one.	1	with	
100	7	00:41:24	it's just a piece of hair.	1	piece	
100	7	00:41:54	come on, Max.	1	on	
100	7	00:41:54	big guy?	1	big	
100	8	00:10:12	do you want to build a castle with those?	1	with	
100	8	00:10:12	with your blocks?	1	with	
100	8	00:10:12	### with this for him then.	1	with	
100	8	00:10:12	thought we put new batteries in this.	1	in	
100	8	00:10:12	Max, come on.	1	on	
100	8	00:10:12	but that's because we build them really tall.	1	tall	
100	8	00:10:12	there's a top.	1	top	
100	8	00:10:12	he can go on top.	2	on, top	
100	8	00:10:12	well we can use the little ones too, right?	2	little, right	
100	8	00:10:12	put it on top?	2	on, top	
100	8	00:12:58	that's all.	1	all	
100	8	00:12:58	right.	1	right	
100	8	00:12:58	should we start a tape on?	1	on	
100	8	00:14:50	there was a little Lucky hair on there.	2	little, on	
100	8	00:14:50	you blew my house down!	1	down	
100	8	00:15:03	let's put -- Timone on the top.	2	on, top	
100	8	00:15:35	should I put that up there?	1	up	
100	8	00:15:35	we could put a couple guys up there!	1	up	
100	8	00:15:35	that's all.	1	all	
100	8	00:15:35	he just wants to play with you.	1	with	
100	8	00:15:35	well babies can play with them too, I think.	1	with	
100	8	00:15:35	you melted right there.	1	right	
100	8	00:15:35	let's settle down, Max.	1	down	
100	8	00:18:16	do you want to make a train with these?	1	with	
100	8	00:18:16	let's go ahead and make that train.	1	ahead	
100	8	00:18:16	### them together?	1	together	
100	8	00:18:57	mix it up!	1	up	
100	8	00:18:57	mix it up!	1	up	
100	8	00:18:57	it's all gone.	1	all	
100	8	00:18:57	it's all gone.	1	all	
100	8	00:19:31	you need another long one?	1	long	
100	8	00:19:41	well this one's taller.	1	taller	
100	8	00:19:46	we only have taller ones.	1	taller	
100	8	00:19:49	we could make a tall one, too, right?	2	tall, right	
100	8	00:19:49	that's a big train, huh?	1	big	
100	8	00:19:49	that someone has a full set of teeth!	1	full	
100	8	00:21:06	that might work better under here.	1	under	
100	8	00:21:17	right.	1	right	
100	8	00:22:33	right.	1	right	
100	8	00:23:08	if we don't have any tracks for it, right?	1	right	
100	8	00:23:08	someone's sitting on your foot.	1	on	
100	8	00:23:08	### a big baby sitting on your foot.	2	big, on	
100	8	00:23:08	come on back over here.	3	on, back, over	
100	8	00:10:00	I'm locking you up in the cage.	2	up, in	
100	8	00:10:00	you didn't turn it over, did you Max?	2	turn, over	
100	8	00:11:15	into a rock?	1	into	
100	8	00:11:15	so I can turn you into a frog?	2	turn, into	
100	8	00:11:15	I'll turn Max into a big frog.	3	turn, into, big	
100	8	00:11:15	you put lotion on them?	1	on	
100	8	00:11:15	now I can turn you into a frog.	2	turn, into	
100	8	00:11:15	if I touch your head I turn you into a frog.	3	head, turn, into	
100	8	00:11:15	I locked you up.	1	up	
100	8	00:11:15	I locked you up.	1	up	
100	8	00:11:15	turned you into a frog.	2	turned, into	
100	8	00:11:15	turned you into a frog!	2	turned, into	
100	8	00:11:15	turned you into a frog.	2	turned, into	
100	8	00:13:17	that's quite a grip you got on there.	1	on	
100	8	00:13:17	now I'm going to turn you into a donkey.	2	turn, into	
100	8	00:14:00	oh I'm going to lock the donkey in the cage.	1	in	
100	8	00:14:00	because I got you in the cage.	1	in	
100	8	00:14:00	ok let's put that away.	1	away	
100	8	00:14:00	ok Max let's leave the wand back there.	1	back	
100	8	00:15:00	Max you have to be -- you have to be gentle with it though.	1	with	
100	8	00:15:03	I'm going to get that little Max.	1	little	
100	8	00:15:03	I'm going to get that little Max Peterson.	1	little	
100	8	00:15:19	now what can I turn you into?	2	turn, into	
100	8	00:15:19	turn you into a snake?	2	turn, into	
100	8	00:15:19	how about a snake?	1	about	
100	8	00:15:19	Max let's not put that over your head.	2	over, head	
100	8	00:15:46	like a big --	1	big	
100	8	00:15:46	you going to come over here?	1	over	
100	8	00:15:46	and I'll lock you up.	1	up	
100	8	00:15:46	I'm going to lock you up over here.	2	up, over	
100	8	00:15:46	locked up.	1	up	
100	8	00:15:46	now can I turn you into a snake?	2	turn, into	
100	8	00:15:46	can I turn you into a fish?	2	turn, into	
100	8	00:15:46	how about a jelly+fish?	1	about	
100	8	00:17:49	in the dirt?	1	in	
100	8	00:18:00	off into the garden.	1	into	
100	8	00:18:00	are you in the cage?	1	in	
100	8	00:19:00	are you in the cage, Max?	1	in	
100	8	00:19:00	worm are you in the cage?	1	in	
100	8	00:19:00	oh he's sleeping in his bed?	1	in	
100	8	00:19:00	from all that work in the yard?	2	all, in	
100	8	00:20:00	he's licking his way around the room.	1	around	
100	8	00:20:00	### to get into the refrigerator, huh?	1	into	
100	8	00:20:00	you can't be sitting on people's feet because you're a worm.	1	on	
100	8	00:20:00	I'll be a colorful worm with you.	1	with	
100	8	00:21:00	right?	1	right	
100	8	00:22:06	she's going to slither all over you.	2	all, over	
100	8	00:22:06	oh right.	1	right	
100	8	00:22:06	breaking the rattle on the worm.	1	on	
100	8	00:22:06	Max, careful back there.	1	back	
100	8	00:22:06	what do you see out there, big guy?	2	out, big	
100	8	00:22:06	what do you see out there Baby_Worm?	1	out	
100	8	00:22:06	we won't be able to get into the dirt.	1	into	
100	8	00:22:06	right?	1	right	
100	8	00:22:06	the dirt in the yard?	1	in	
103	5	00:35:47	how about a pond?	1	about	
103	5	00:35:47	here, you can put those together and make a circle.	2	together, circle	
103	5	00:35:47	and a little bridge?	1	little	
103	5	00:36:58	you can put a couple of these together and put a roof on top.	3	together, on, top	
103	5	00:36:58	pizza or piece?	1	piece	
103	5	00:36:58	piece.	1	piece	
103	5	00:36:58	what about the clock?	1	about	
103	5	00:38:00	right here?	1	right	
103	5	00:39:03	she's got a blanket right here.	1	right	
103	5	00:39:03	turned it back on?	3	turned, back, on	
103	5	00:39:03	do you think she might need a bottle of water or something to put on her table?	1	on	
103	5	00:39:03	maybe if we put two pieces underneath it, it'll stand.	2	pieces, underneath	
103	5	00:39:03	and put these two together.	1	together	
103	5	00:39:03	under the table.	1	under	
103	5	00:42:11	just -- lay a pillow down.	1	down	
103	5	00:42:11	we can fold this up.	1	up	
103	5	00:42:11	we can put this on him.	1	on	
103	5	00:42:11	how about that?	1	about	
103	5	00:42:11	who do you think's going to wake up first?	2	up, first	
103	5	00:42:11	because she went to sleep first?	1	first	
103	5	00:42:11	she went to sleep with those shoes on, Luck.	2	with, on	
103	5	00:43:18	did you turn it back on?	3	turn, back, on	
103	5	00:43:30	what'd you step on?	1	on	
103	5	00:44:33	you tuck the little ends in.	2	little, in	
103	5	00:44:33	how small can you fold it?	1	small	
103	5	00:44:33	putting it in there?	1	in	
103	5	00:44:33	I don't think -- there's anything in there to play with, Lucky.	2	in, with	
103	5	00:44:33	let's keep it in the box, ok?	1	in	
103	5	00:45:55	let's put the lid on it.	1	on	
103	5	00:45:55	can you put it back?	1	back	
103	5	00:46:00	something to clean with.	1	with	
103	5	00:46:00	you can play with the box, ok?	1	with	
103	5	00:46:00	play with the box -- but not this.	1	with	
103	5	00:46:00	Doggie jumped in there.	1	in	
103	5	00:46:00	he jumped in, Luck.	1	in	
103	5	00:46:00	if you put them sideways they might fit, but not like that.	1	sideways	
103	5	00:46:00	just on their ends.	1	on	
103	5	00:47:04	standing up.	1	up	
103	5	00:47:04	maybe you can get two in there.	1	in	
103	5	00:47:04	you have to put them on an angle to fit.	2	on, angle	
103	5	00:47:04	you can put one in the way that you had it and then slide one in like that.	2	in, in	
103	5	00:47:04	### fell over.	1	over	
103	5	00:47:04	she was standing up and she just fell over.	2	up, over	
103	5	00:47:04	want to get the matching yellow piece out?	2	piece, out	
103	5	00:47:04	did you lock him up?	1	up	
103	5	00:49:43	I can't see anything in there.	1	in	
103	5	00:51:38	I can see all the stars.	1	all	
103	5	00:51:38	that's what we use -- when you have -- our dinner in the tv room.	1	in	
103	5	00:51:38	what do you do with your legs?	1	with	
103	5	00:51:38	you can walk over there, right?	2	over, right	
103	5	00:51:38	think you woke him up.	1	up	
103	5	00:51:38	are you fanning him with the flag?	1	with	
103	5	00:51:38	he's sitting on the table.	1	on	
103	5	00:51:38	he jumped up on the table, Lucky.	2	up, on	
103	5	00:51:38	do you think the baby wants to have some juice?	1	some	
103	5	00:54:01	there's a knot in the scarf.	1	in	
103	5	00:54:01	that's a big blanket for a little doggie.	2	big, little	
103	5	00:54:01	is he in the park?	1	in	
103	5	00:54:01	I see lots of flowers around him.	1	around	
103	5	00:54:01	he's been running around all day.	2	around, all	
103	5	00:54:01	he must have played chase, right?	1	right	
103	5	00:54:01	do you want one of the other guys to play with?	1	with	
103	5	00:54:01	does Deno want to play with ###?	1	with	
103	5	00:54:01	Deno doesn't want to play with ###	1	with	
103	5	00:54:01	do you want to give her some juice?	1	some	
103	5	00:54:01	I saw the bottle over there.	1	over	
103	5	00:54:01	can I -- break up this house?	1	up	
103	5	00:54:01	and then you can put something right here.	1	right	
103	5	00:54:01	it's right there.	1	right	
103	5	00:54:01	right here.	1	right	
103	5	00:54:01	this little dress came off.	1	little	
103	5	00:59:00	what did you get upset about?	1	about	
103	5	00:59:00	did the house not look right?	1	right	
103	5	00:59:00	I think it's just too tall to stand up.	2	tall, up	
103	5	00:59:00	it's too skinny.	1	skinny	
103	5	00:59:00	we can't build it up too high unless there's something supporting it.	2	up, high	
103	5	00:59:00	it's just going to fall down again.	1	down	
103	5	00:59:00	you have to put something behind it.	1	behind	
103	5	00:59:58	### with one of these.	1	with	end of tape 1
103	8	00:32:11	ok I'm putting you down.	1	down	
103	8	00:32:24	here, kneel down.	1	down	
103	8	00:32:24	put your -- feet down.	1	down	
103	8	00:32:24	roll into a ball.	1	into	
103	8	00:32:24	roll into a ball.	1	into	
103	8	00:32:38	put your head this way.	1	head	
103	8	00:32:38	keep your knees tucked under.	1	under	
103	8	00:32:38	scoot your knees up.	1	up	
103	8	00:32:38	ok, tuck your head in.	2	head, in	
103	8	00:32:38	alright, tuck your head in.	2	head, in	
103	8	00:32:38	tuck your head in.	2	head, in	
103	8	00:33:52	away from the shelves.	1	away	
103	8	00:33:52	knees together.	1	together	
103	8	00:33:52	head down.	2	head, down	
103	8	00:33:52	tuck in.	1	in	
103	8	00:35:00	you have to move your waist a little bit.	2	little, bit	
103	8	00:35:00	she's going to have about twenty hula hoops.	1	about	
103	8	00:32:15	come on and put on your hat.	2	on, on	
103	8	00:32:15	if you're walking around.	1	around	
103	8	00:32:15	should you be banging something on the ground?	1	on	
103	8	00:32:41	big trees?	1	big	
103	8	00:32:41	we have trees all around.	2	all, around	
103	8	00:32:41	we need to put more style around.	1	around	
103	8	00:33:52	let's put this stuff back.	1	back	
103	8	00:33:52	keep the door closed before we put everything back.	2	before, back	
103	8	00:33:52	put that back.	1	back	
103	8	00:35:13	do you want to sweep up the leaves?	1	up	
103	8	00:35:13	there's a bunch on this side.	2	on, side	
103	8	00:35:13	not into the garage.	1	into	
103	8	00:35:13	to the side.	1	side	
105	5	00:43:31	look how tall yours is.	1	tall	
105	5	00:43:31	maybe a tornado came and lifted your house up.	1	up	
105	5	00:43:31	maybe that's why your house blew over.	1	over	
105	5	00:44:27	there's your witch over there, too.	1	over	
105	5	00:44:33	here's some more for your witches.	1	some	
105	5	00:45:12	right.	1	right	
105	5	00:45:12	can you get the yellow and the blue ones and bring them over here?	1	over	
105	5	00:45:12	### got some more right here.	2	some, right	
105	5	00:45:12	on tv?	1	on	
105	5	00:45:12	Keeley, don't ### with that.	1	with	
105	5	00:46:28	alright, let's put them back in the box.	2	back, in	
105	5	00:46:28	oh, I ### away.	1	away	
105	5	00:46:28	you cleaned it all up!	2	all, up	
105	5	00:46:28	we can play -- how about -- ### -- Buzz_Light_Year game?	1	about	
107	4	00:00:10	blocks, right.	1	right	
107	4	00:00:10	let's see how big we can make a building.	1	big	
107	4	00:00:10	can mommy put one right here?	1	right	
107	4	00:00:21	did they fall down?	1	down	
107	4	00:00:21	fall down?	1	down	
107	4	00:00:21	you push it down right here.	2	down, right	
107	4	00:00:21	push down, see?	1	down	
107	4	00:00:42	push down.	1	down	
107	4	00:00:45	push down.	1	down	
107	4	00:00:45	it fall down?	1	down	
107	4	00:00:45	should we pick it back up?	2	back, up	
107	4	00:00:45	put it back together?	2	back, together	
107	4	00:01:32	put on more blocks?	1	on	
107	4	00:01:47	you want to put them on top of your piano?	2	on, top	
107	4	00:01:47	over here Sean?	1	over	
107	4	00:01:47	put blocks on top of the piano, see?	2	on, top	
107	4	00:01:47	put some blocks there.	1	some	
107	4	00:01:47	got some more blocks.	1	some	
107	4	00:00:47	you like sitting up in the chair.	2	up, in	
107	6	00:31:04	all right, give it to mommy I'll -- I'll try.	2	all, right	M and C talk at same time.
107	6	00:31:06	why don't we do it together?	1	together	
107	6	00:31:18	maybe it doesn't come apart.	1	apart	
107	6	00:31:21	maybe it doesn't come apart.	1	apart	
107	6	00:31:21	maybe it's one piece.	1	piece	
107	6	00:31:21	now go pick it up please.	1	up	
107	6	00:31:21	go pick it up.	1	up	
107	6	00:31:38	it's enough.	1	enough	
107	6	00:31:38	where is -- where is that piece?	1	piece	
107	6	00:31:38	that's all.	1	all	
107	6	00:31:38	then Sean will get it by himself -- pretty soon.	1	by	
107	6	00:31:38	put a building together?	1	together	
107	6	00:31:38	we got other blocks here too we can play with.	1	with	
107	6	00:31:38	we can put this one -- on.	1	on	
107	6	00:32:16	how many -- how many blocks are in that one.	1	in	
107	6	00:32:16	Sean look how tall that is.	1	tall	
107	6	00:33:27	should we make a little birdhouse?	1	little	
107	6	00:33:27	we could make this a little birdhouse.	1	little	
107	6	00:33:27	we'll put the bird in his house.	1	in	
107	6	00:33:27	I don't know he'll -- he'll stay up there.	1	up	
107	6	00:33:27	we'll put him right here.	1	right	
107	6	00:33:50	you want to put the bird up there?	1	up	
107	6	00:34:26	right.	1	right	
107	6	00:34:35	right?	1	right	
107	6	00:36:15	this is stuck together.	1	together	M talks to sib.
107	6	00:36:15	nice and tall.	1	tall	
107	6	00:36:15	do we see them outside?	1	outside	
107	6	00:36:59	we have lots of buildings outside.	1	outside	
107	6	00:36:55	one right next to each other.	2	right, next	
107	6	00:37:37	right.	1	right	M talks to sib.
107	6	00:37:58	look how tall that is.	1	tall	
107	6	00:38:15	there's a window in the building.	1	in	
107	6	00:38:15	Sean made a building with a window.	1	with	
107	6	00:38:52	I don't know if you can put that in your mouth.	1	in	M talks to sib.
107	6	00:38:52	right dog.	1	right	M talks to sib.
107	6	00:38:52	did it fall down?	1	down	
107	6	00:40:00	that's his face.	1	face	M talks to sib.
107	6	00:40:00	mommy give it back to Matthew.	1	back	M talks to sib.
107	6	00:40:00	see we take turns.	1	turns	M talks to sib.
107	6	00:40:00	take turns.	1	turns	M talks to sib.
107	6	00:40:33	mommy found some more blocks Sean.	1	some	
107	6	00:40:38	can you put that on the house?	1	on	
107	6	00:40:45	oh, put it in the farm.	1	in	
107	6	00:40:45	right, the snow+man fell in the water.	2	right, in	
107	6	00:40:45	right, and Rudolph did he go save him?	1	right	
107	6	00:42:42	and all of --	1	all	
107	6	00:43:46	join in any --	2	join, in	
107	6	00:44:19	goes in a tree.	1	in	M talks to sib.
107	6	00:44:34	that was tall.	1	tall	
107	6	00:44:34	that was a big building.	1	big	
107	6	00:44:34	oh yeah, look at the window in the building.	1	in	
107	6	00:44:34	you can look outside.	1	outside	
107	6	00:44:34	through the window.	1	through	
107	6	00:46:23	look at the balls inside.	1	inside	M talks to sib.
107	6	00:58:52	ok, Matthew let's play over here.	1	over	M talks to sib.
107	6	00:58:52	put these away.	1	away	
